{
  "schema_version": 1,
  "case_id": "repository_current--ofat--triceps--alpha_a--x2",
  "provenance": "repository_current independent OFAT; Triceps alpha_a x2; experimental Ding sensitivity, not clinical calibration",
  "muscles": {
    "Delt_ant": {"Fmax": 48.0, "a_scale": 1148.6, "alpha_a": -1.4, "tau_fat": 445.5},
    "Delt_post": {"Fmax": 51.0, "a_scale": 1234.5, "alpha_a": -1.1, "tau_fat": 342.7},
    "Biceps": {"Fmax": 149.0, "a_scale": 3314.7, "alpha_a": -0.56, "tau_fat": 179.6},
    "Triceps": {"Fmax": 617.0, "a_scale": 7036.3, "alpha_a": -0.48, "tau_fat": 76.2}
  }
}
